{
  "$schema": "https://json-schema.org/draft/2020-12/schema",
  "title": "ConnectWise daily tickets, time, and end-of-day report",
  "type": "object",
  "additionalProperties": false,
  "required": [
    "date",
    "items"
  ],
  "properties": {
    "schemaVersion": {
      "const": "1.2"
    },
    "exampleOnly": {
      "type": "boolean"
    },
    "timeZone": {
      "const": "America/New_York"
    },
    "date": {
      "type": "string",
      "format": "date"
    },
    "endOfDay": {
      "type": "object",
      "additionalProperties": false,
      "properties": {
        "subject": {
          "type": "string",
          "minLength": 1
        },
        "inventory": {
          "type": "array",
          "items": {
            "type": "object",
            "additionalProperties": false,
            "required": [
              "item"
            ],
            "properties": {
              "item": {
                "type": "string",
                "minLength": 1
              },
              "count": {
                "type": "string",
                "minLength": 1
              },
              "quantity": {
                "type": "integer",
                "minimum": 0
              },
              "model": {
                "type": "string",
                "minLength": 1
              }
            },
            "oneOf": [
              {
                "required": [
                  "count"
                ],
                "not": {
                  "required": [
                    "quantity"
                  ]
                }
              },
              {
                "required": [
                  "quantity"
                ],
                "not": {
                  "required": [
                    "count"
                  ]
                }
              }
            ]
          }
        },
        "purchases": {
          "type": "array",
          "items": {
            "type": "object",
            "additionalProperties": false,
            "required": [
              "item",
              "quantity",
              "url"
            ],
            "properties": {
              "item": {
                "type": "string",
                "minLength": 1
              },
              "quantity": {
                "type": "integer",
                "minimum": 1
              },
              "url": {
                "type": "string",
                "pattern": "^https?://"
              }
            }
          }
        },
        "docCams": {
          "anyOf": [
            {
              "type": "null"
            },
            {
              "type": "object",
              "additionalProperties": false,
              "properties": {
                "inUse": {
                  "type": "integer",
                  "minimum": 0
                },
                "neededIn": {
                  "type": "array",
                  "items": {
                    "anyOf": [
                      {
                        "type": "string",
                        "minLength": 1
                      },
                      {
                        "type": "integer",
                        "minimum": 0
                      }
                    ]
                  }
                }
              },
              "anyOf": [
                {
                  "required": [
                    "inUse"
                  ]
                },
                {
                  "required": [
                    "neededIn"
                  ]
                }
              ]
            }
          ]
        }
      }
    },
    "items": {
      "type": "array",
      "minItems": 1,
      "items": {
        "$ref": "week.schema.json#/properties/items/items"
      }
    }
  }
}
